{
  "artifacts": [
    {
      "sha256": "816d77d1defc554077405f5fc8750ac45a78b72ed21a26daec8b887c6cea34c5",
      "type": "video-artifact"
    }
  ],
  "assertions": [
    {
      "name": "registered-source-detected",
      "passed": true
    },
    {
      "name": "registered-platform-matches",
      "passed": true
    },
    {
      "name": "registered-source-fingerprint-matches",
      "passed": true
    },
    {
      "name": "registered-source-is-canonical",
      "passed": true
    },
    {
      "name": "download-command-succeeded",
      "passed": true
    },
    {
      "name": "video-artifact-v2-valid",
      "passed": true
    },
    {
      "name": "video-media-reverified",
      "passed": true
    },
    {
      "name": "controlled-downloader-entrypoints-stable",
      "passed": true
    },
    {
      "name": "controlled-fallback-fresh-output-observed",
      "passed": true
    },
    {
      "name": "controlled-fault-profile-applied",
      "passed": true
    },
    {
      "name": "controlled-gallery-dl-command-verified",
      "passed": true
    },
    {
      "name": "controlled-gallery-dl-executed-exactly-once",
      "passed": true
    },
    {
      "name": "controlled-production-fallback-gate-accepted",
      "passed": true
    },
    {
      "name": "controlled-ytdlp-command-verified",
      "passed": true
    },
    {
      "name": "controlled-ytdlp-fault-triggered-exactly-once",
      "passed": true
    },
    {
      "name": "controlled-ytdlp-network-error-observed",
      "passed": true
    },
    {
      "name": "required-gallery-dl-observed",
      "passed": true
    },
    {
      "name": "required-tools-observed",
      "passed": true
    }
  ],
  "case_id": "twitter-gallery-fallback",
  "commit_sha": "e867c53b1629c3d0d880a7d3f5560e952e27571d",
  "created_at": "2026-07-31T08:28:01+00:00",
  "engine": null,
  "environment": {
    "arch": "arm64",
    "os": "macos",
    "python": "3.14.6"
  },
  "implementation_digest": "3e4f444286dae11941b141e91df5b2bfe75033a02f43fdac5bae2f99745d96a9",
  "outcome": "pass",
  "schema_version": "awesome-capture.smoke-receipt/v1",
  "source": {
    "auth_mode": "anonymous",
    "fallback": "gallery-dl",
    "fingerprint": "272c3cd8f41e281f00689741caf02f4ba2bb149d5b2d0644016c9d997221a7d1",
    "platform": "twitter"
  },
  "tools": [
    {
      "name": "python",
      "version": "3.14.6"
    },
    {
      "name": "ffmpeg",
      "version": "ffmpeg version 8.1 Copyright (c) 2000-2026 the FFmpeg developers"
    },
    {
      "name": "ffprobe",
      "version": "ffprobe version 8.1 Copyright (c) 2007-2026 the FFmpeg developers"
    },
    {
      "name": "yt-dlp",
      "version": "2026.07.04"
    },
    {
      "name": "gallery-dl",
      "version": "1.32.8"
    },
    {
      "name": "awesome-capture-smoke-fault",
      "version": "x-first-ytdlp-network-error-v1"
    }
  ],
  "warnings": [
    "controlled-ytdlp-network-error-injection",
    "download-reported-1-warnings"
  ]
}
