{
  "artifacts": [
    {
      "sha256": "2b44c9d102b8ed4a4460401d75d80973ab47a543fbd603f05ed065ed178591fa",
      "type": "video-artifact"
    }
  ],
  "assertions": [
    {
      "name": "registered-source-detected",
      "passed": true
    },
    {
      "name": "registered-platform-matches",
      "passed": true
    },
    {
      "name": "registered-source-fingerprint-matches",
      "passed": true
    },
    {
      "name": "registered-source-is-canonical",
      "passed": true
    },
    {
      "name": "download-command-succeeded",
      "passed": true
    },
    {
      "name": "video-artifact-v2-valid",
      "passed": true
    },
    {
      "name": "video-media-reverified",
      "passed": true
    },
    {
      "name": "anonymous-route-observed",
      "passed": true
    },
    {
      "name": "required-tools-observed",
      "passed": true
    }
  ],
  "case_id": "bilibili-anonymous",
  "commit_sha": "47422cc7402c24de5639700ebf0e5c82b895efcd",
  "created_at": "2026-07-29T17:04:24+00:00",
  "engine": null,
  "environment": {
    "arch": "arm64",
    "os": "macos",
    "python": "3.14.6"
  },
  "implementation_digest": "7cc24980ab69282575d8752634de5bc102d2c445951693976c1a98badc0481aa",
  "outcome": "pass",
  "schema_version": "awesome-capture.smoke-receipt/v1",
  "source": {
    "auth_mode": "anonymous",
    "fallback": "none",
    "fingerprint": "036d8ae343642d346f08695e683ca3a71c9c67faac104eacb46e2534dc7068c6",
    "platform": "bilibili"
  },
  "tools": [
    {
      "name": "python",
      "version": "3.14.6"
    },
    {
      "name": "ffmpeg",
      "version": "ffmpeg version 8.1 Copyright (c) 2000-2026 the FFmpeg developers"
    },
    {
      "name": "ffprobe",
      "version": "ffprobe version 8.1 Copyright (c) 2007-2026 the FFmpeg developers"
    },
    {
      "name": "yt-dlp",
      "version": "2026.07.04"
    }
  ],
  "warnings": []
}
