{
  "artifacts": [
    {
      "sha256": "a6f98a197f3a8d386c7d634a6f20ac63e6d14a9f7cc8ef2388eae63168255b5d",
      "type": "video-artifact"
    }
  ],
  "assertions": [
    {
      "name": "registered-source-detected",
      "passed": true
    },
    {
      "name": "registered-platform-matches",
      "passed": true
    },
    {
      "name": "registered-source-fingerprint-matches",
      "passed": true
    },
    {
      "name": "registered-source-is-canonical",
      "passed": true
    },
    {
      "name": "download-command-succeeded",
      "passed": true
    },
    {
      "name": "video-artifact-v2-valid",
      "passed": true
    },
    {
      "name": "video-media-reverified",
      "passed": true
    },
    {
      "name": "required-ephemeral_browser-observed",
      "passed": true
    },
    {
      "name": "required-tools-observed",
      "passed": true
    }
  ],
  "case_id": "douyin-ephemeral-browser",
  "commit_sha": "f0018a4f30339e7bcb2e02168fe1688894d4db6b",
  "created_at": "2026-10-04T06:17:26+00:00",
  "engine": null,
  "environment": {
    "arch": "arm64",
    "os": "macos",
    "python": "3.14.6"
  },
  "implementation_digest": "ef549b7726a2dd9da00a30817260426aa8e997c9343f642d454dad21f23cadc5",
  "outcome": "pass",
  "schema_version": "awesome-capture.smoke-receipt/v1",
  "source": {
    "auth_mode": "ephemeral_browser",
    "fallback": "ephemeral_browser",
    "fingerprint": "4de80c64366890c0eeff5c8f04eeed58bc54d48255c613a3254496d35c66ac62",
    "platform": "douyin"
  },
  "tools": [
    {
      "name": "python",
      "version": "3.14.6"
    },
    {
      "name": "ffmpeg",
      "version": "ffmpeg version 8.1 Copyright (c) 2000-2026 the FFmpeg developers"
    },
    {
      "name": "ffprobe",
      "version": "ffprobe version 8.1 Copyright (c) 2007-2026 the FFmpeg developers"
    },
    {
      "name": "yt-dlp",
      "version": "2026.07.04"
    },
    {
      "name": "playwright",
      "version": "1.60.0"
    },
    {
      "name": "chromium",
      "version": "148.0.7778.96"
    }
  ],
  "warnings": [
    "download-reported-2-warnings"
  ]
}
